"Crop Category","Crops/Plants","Typical Soil pH","Nitrogen (kg/ha)","Soil Depth (cm)"
"Food grains","Rice (Paddy), Ragi, Jowar, Bajra, Maize, Millets","6.5 - 7.5","100 - 140","10 - 20"
"Pulses","Black gram, Green gram, Red gram, Horse gram","6.5 - 7.2","110 - 130","10 - 15"
"Oilseeds","Groundnut, Gingelly (Sesame)","6.0 - 7.0","100 - 120","10 - 15"
"Cash crops","Sugarcane, Cotton, Tobacco","6.5 - 7.8","120 - 140","15 - 20"
"Fruits","Mango, Banana, Guava, Sapota, Jackfruit, Papaya, Grapes","6.5 - 7.8","200 - 350","20 - 25"
"Vegetables","Tomato, Brinjal, Chillies, Onion, Bhendi (Okra), Tapioca","6.0 - 7.2","80 - 130","10 - 15"
"Plantation crops","Coconut, Cashew, Arecanut, Rubber","6.5 - 7.5","150 - 300","25 - 35"